{
  "geox_version": "0.1.0",
  "total_skills": 33,
  "total_domains": 11,
  "skills_per_domain": 3,
  "domains": [
    "sensing",
    "geodesy",
    "terrain",
    "water",
    "atmosphere",
    "mobility",
    "infrastructure",
    "hazards",
    "governance",
    "time",
    "orchestration"
  ],
  "substrates": [
    "human",
    "machine-fixed",
    "machine-mobile",
    "infrastructure",
    "orbital",
    "environment-field",
    "celestial",
    "void"
  ],
  "scales": ["site", "corridor", "district", "region", "nation", "maritime"],
  "horizons": ["immediate", "short", "medium", "long"],
  "skills": [
    {
      "id": "geox.sensing.observation-intake",
      "title": "Observation Intake",
      "domain": "sensing",
      "filename": "sense-observation-intake.md",
      "substrates": ["human", "machine-fixed", "machine-mobile", "orbital", "environment-field"],
      "scales": ["site", "corridor", "district", "region"],
      "horizons": ["immediate", "short"],
      "inputs": ["raw-reports", "sensor-streams", "satellite-feed", "api-data", "field-notes"],
      "outputs": ["normalized-observations", "schema-compliant-records"],
      "depends_on": [],
      "mcp_resource": true,
      "mcp_prompt": false,
      "mcp_tool": true,
      "risk_class": "low",
      "human_confirmation": false,
      "drift_sensitivity": "medium",
      "legal_domain": "public",
      "status": "draft"
    },
    {
      "id": "geox.sensing.signal-classification",
      "title": "Signal Classification",
      "domain": "sensing",
      "filename": "sense-signal-classification.md",
      "substrates": ["machine-fixed", "machine-mobile", "orbital", "environment-field"],
      "scales": ["site", "corridor", "district"],
      "horizons": ["immediate"],
      "inputs": ["signal-data", "frequency-data", "sensor-metadata"],
      "outputs": ["signal-type", "source-class", "confidence-band"],
      "depends_on": ["geox.sensing.observation-intake"],
      "mcp_resource": true,
      "mcp_prompt": false,
      "mcp_tool": true,
      "risk_class": "low",
      "human_confirmation": false,
      "drift_sensitivity": "medium",
      "legal_domain": "public",
      "status": "draft"
    },
    {
      "id": "geox.sensing.observation-qc",
      "title": "Observation QC",
      "domain": "sensing",
      "filename": "sense-observation-qc.md",
      "substrates": ["human", "machine-fixed", "machine-mobile", "orbital", "environment-field", "void"],
      "scales": ["site", "corridor", "district", "region"],
      "horizons": ["immediate", "short"],
      "inputs": ["normalized-observations", "calibration-data", "trust-indicators"],
      "outputs": ["qc-scores", "freshness-rating", "contamination-flags"],
      "depends_on": ["geox.sensing.observation-intake"],
      "mcp_resource": true,
      "mcp_prompt": false,
      "mcp_tool": true,
      "risk_class": "medium",
      "human_confirmation": false,
      "drift_sensitivity": "high",
      "legal_domain": "public",
      "status": "draft"
    },
    {
      "id": "geox.geodesy.coordinate-frames",
      "title": "Coordinate Frames",
      "domain": "geodesy",
      "filename": "geo-coordinate-frames.md",
      "substrates": ["machine-fixed", "machine-mobile", "infrastructure", "orbital"],
      "scales": ["site", "corridor", "district", "region", "nation", "maritime"],
      "horizons": ["immediate", "short"],
      "inputs": ["lat-lon", "projected-grids", "local-site-frames", "vessel-tracks", "image-tiles"],
      "outputs": ["transformed-coordinates", "frame-report"],
      "depends_on": [],
      "mcp_resource": true,
      "mcp_prompt": false,
      "mcp_tool": true,
      "risk_class": "low",
      "human_confirmation": false,
      "drift_sensitivity": "low",
      "legal_domain": "public",
      "status": "draft"
    },
    {
      "id": "geox.geodesy.position-fix-fusion",
      "title": "Position Fix Fusion",
      "domain": "geodesy",
      "filename": "geo-position-fix-fusion.md",
      "substrates": ["machine-mobile", "infrastructure", "orbital", "environment-field"],
      "scales": ["site", "corridor", "district"],
      "horizons": ["immediate"],
      "inputs": ["gps-gnss", "inertial-hints", "map-anchors", "reported-positions"],
      "outputs": ["fused-position", "confidence-ellipse", "fix-quality"],
      "depends_on": ["geox.geodesy.coordinate-frames"],
      "mcp_resource": true,
      "mcp_prompt": false,
      "mcp_tool": true,
      "risk_class": "medium",
      "human_confirmation": false,
      "drift_sensitivity": "medium",
      "legal_domain": "public",
      "status": "draft"
    },
    {
      "id": "geox.geodesy.scale-and-tiling",
      "title": "Scale and Tiling",
      "domain": "geodesy",
      "filename": "geo-scale-and-tiling.md",
      "substrates": ["machine-fixed", "infrastructure", "orbital"],
      "scales": ["site", "corridor", "district", "region", "nation", "maritime"],
      "horizons": ["short", "medium"],
      "inputs": ["multi-scale-data", "tile-indexes", "resolution-requirements"],
      "outputs": ["tiled-data", "scale-adjusted-outputs"],
      "depends_on": ["geox.geodesy.coordinate-frames"],
      "mcp_resource": true,
      "mcp_prompt": false,
      "mcp_tool": true,
      "risk_class": "low",
      "human_confirmation": false,
      "drift_sensitivity": "low",
      "legal_domain": "public",
      "status": "draft"
    },
    {
      "id": "geox.terrain.relief-and-slope",
      "title": "Relief and Slope",
      "domain": "terrain",
      "filename": "terrain-relief-and-slope.md",
      "substrates": ["machine-fixed", "machine-mobile", "orbital", "environment-field"],
      "scales": ["site", "corridor", "district", "region"],
      "horizons": ["short", "medium"],
      "inputs": ["dem-data", "terrain-models", "bathymetry"],
      "outputs": ["slope-maps", "aspect-maps", "ridge-depression-report", "movement-penalty"],
      "depends_on": ["geox.geodesy.coordinate-frames"],
      "mcp_resource": true,
      "mcp_prompt": false,
      "mcp_tool": true,
      "risk_class": "low",
      "human_confirmation": false,
      "drift_sensitivity": "low",
      "legal_domain": "public",
      "status": "draft"
    },
    {
      "id": "geox.terrain.surface-access",
      "title": "Surface Access",
      "domain": "terrain",
      "filename": "terrain-surface-access.md",
      "substrates": ["human", "machine-mobile", "environment-field"],
      "scales": ["site", "corridor", "district"],
      "horizons": ["immediate", "short"],
      "inputs": ["terrain-data", "surface-type", "weather-state", "vehicle-class"],
      "outputs": ["traversability-scores", "access-routes", "constraint-report"],
      "depends_on": ["geox.terrain.relief-and-slope", "geox.atmosphere.weather-state"],
      "mcp_resource": true,
      "mcp_prompt": false,
      "mcp_tool": true,
      "risk_class": "medium",
      "human_confirmation": false,
      "drift_sensitivity": "high",
      "legal_domain": "civil",
      "status": "draft"
    },
    {
      "id": "geox.terrain.drainage-structure",
      "title": "Drainage Structure",
      "domain": "terrain",
      "filename": "terrain-drainage-structure.md",
      "substrates": ["machine-fixed", "orbital", "environment-field"],
      "scales": ["site", "corridor", "district", "region"],
      "horizons": ["short", "medium"],
      "inputs": ["terrain-models", "hydro-data", "soil-data", "land-cover"],
      "outputs": ["runoff-paths", "catchment-areas", "blockage-points", "erosion-exposure"],
      "depends_on": ["geox.terrain.relief-and-slope", "geox.water.hydrology-basics"],
      "mcp_resource": true,
      "mcp_prompt": false,
      "mcp_tool": true,
      "risk_class": "medium",
      "human_confirmation": false,
      "drift_sensitivity": "medium",
      "legal_domain": "public",
      "status": "draft"
    },
    {
      "id": "geox.water.hydrology-basics",
      "title": "Hydrology Basics",
      "domain": "water",
      "filename": "water-hydrology-basics.md",
      "substrates": ["machine-fixed", "orbital", "environment-field"],
      "scales": ["site", "corridor", "district", "region"],
      "horizons": ["short", "medium"],
      "inputs": ["river-network", "basin-data", "precipitation", "soil-moisture"],
      "outputs": ["runoff-estimate", "storage-levels", "channel-capacity"],
      "depends_on": ["geox.terrain.drainage-structure"],
      "mcp_resource": true,
      "mcp_prompt": false,
      "mcp_tool": true,
      "risk_class": "low",
      "human_confirmation": false,
      "drift_sensitivity": "medium",
      "legal_domain": "public",
      "status": "draft"
    },
    {
      "id": "geox.water.floodplain-and-flow",
      "title": "Floodplain and Flow",
      "domain": "water",
      "filename": "water-floodplain-and-flow.md",
      "substrates": ["human", "machine-fixed", "machine-mobile", "environment-field"],
      "scales": ["site", "corridor", "district"],
      "horizons": ["immediate", "short"],
      "inputs": ["water-levels", "terrain-data", "infrastructure-data", "rainfall-nowcast"],
      "outputs": ["flood-spread", "bottleneck-report", "overtopping-risk", "inundation-sequence"],
      "depends_on": ["geox.water.hydrology-basics", "geox.terrain.drainage-structure"],
      "mcp_resource": true,
      "mcp_prompt": false,
      "mcp_tool": true,
      "risk_class": "high",
      "human_confirmation": true,
      "drift_sensitivity": "high",
      "legal_domain": "civil",
      "status": "draft"
    },
    {
      "id": "geox.water.maritime-state",
      "title": "Maritime State",
      "domain": "water",
      "filename": "water-maritime-state.md",
      "substrates": ["machine-fixed", "machine-mobile", "orbital", "environment-field"],
      "scales": ["corridor", "district", "maritime"],
      "horizons": ["immediate", "short"],
      "inputs": ["current-data", "wave-data", "tide-data", "weather-forecast"],